FILENAME,THREAD,MAIL ARCHIVAL,DATE
5f9f84195842955d295f03ffa99be9f6,Java client problem w/ zookeeper,http://mail-archives.apache.org/mod_mbox/hbase-user/,201001
acefdfe5dde859deb54dd790020fd22d,=?GB2312?Q?Re=3A_=B4=F0=B8=B4=3A_=B4=F0=B8=B4=3A_Should_we_set_the_property_=22hbas?=,http://mail-archives.apache.org/mod_mbox/hbase-user/,201312
12ad94ad334958904c119bb41912f627,Compaction problem,http://mail-archives.apache.org/mod_mbox/hbase-user/,201303
d973e1cb7210959fb20a827d0c038762,HBase - Performance issue,http://mail-archives.apache.org/mod_mbox/hbase-user/,201304
6c4d6a9839e03219384111742da98251,Unable to load Coprocessor jar file in HBase,http://mail-archives.apache.org/mod_mbox/hbase-user/,201505
4fdb5103efdfd5089bf34f41b0948c05,Regions offlined..,http://mail-archives.apache.org/mod_mbox/hbase-user/,201008
1aab7a09fa2d8150d008be212eb48894,problem regarding hadoop,http://mail-archives.apache.org/mod_mbox/hbase-user/,201001
cf6c30daa3952b52ba583c91eb309429,HBase recovery failuer problem,http://mail-archives.apache.org/mod_mbox/hbase-user/,200810
60aed756f6c47aa5988b5f48d13f67c4,HBase client - reduce client retries when connect fail,http://mail-archives.apache.org/mod_mbox/hbase-user/,201102
74abc1bd0a39c988a46ebba2c423c779,Best practices for loading data into hbase,http://mail-archives.apache.org/mod_mbox/hbase-user/,201305
3ee7848abeb4ce789870769f5c88c4c3,question about RS to DN timeouts,http://mail-archives.apache.org/mod_mbox/hbase-user/,201104
a4f1d4e746cedb55e91b4e8aa1db79e9,failure after importing 42million rows,http://mail-archives.apache.org/mod_mbox/hbase-user/,200807
6fd151a3c35f040220d517437fb0c20c,hbase connection issue,http://mail-archives.apache.org/mod_mbox/hbase-user/,200907
790dd56255ff734f969f4a0062f8614d,Problem Accessing Hbase,http://mail-archives.apache.org/mod_mbox/hbase-user/,200807
9513b12811ed40c2fd1851edcca6bc67,Running hBase in a different user account from hadoop,http://mail-archives.apache.org/mod_mbox/hbase-user/,200805
eb2dabcb4afb775ce47f4dc6c120c7d0,HBase with HDFS - Basic setup problem,http://mail-archives.apache.org/mod_mbox/hbase-user/,200808
0ce6b3773a486b3a7ce940ff56f85637,hbase-master-server slept,http://mail-archives.apache.org/mod_mbox/hbase-user/,201302
a77fea2f93d8cd2894cd262811d2271a,"how config multi regionserver, or what is wrong?",http://mail-archives.apache.org/mod_mbox/hbase-user/,201212
1895c5817db01c76017fd712169f881b,Bulk loading disadvantages,http://mail-archives.apache.org/mod_mbox/hbase-user/,201207
a8cd1b69fbc29e74c3341c871862ad4a,secure bulkload hfiles Failed 0.94.15,http://mail-archives.apache.org/mod_mbox/hbase-user/,201406
f802f22123912268c1033ea3751106d7,Region Server lost response when doing BatchUpdate,http://mail-archives.apache.org/mod_mbox/hbase-user/,200904
42e1f7f8eef1c953adaf0fc09f8c75c0,Odd WARN in hbase 0.94.2,http://mail-archives.apache.org/mod_mbox/hbase-user/,201303
9c04df5bb903361850146a756b8f80ee,Problems with write performance (25kb rows),http://mail-archives.apache.org/mod_mbox/hbase-user/,200912
e8af013fd66b616f266af2f5635b02cc,Additional disk space required for Hbase compactions..,http://mail-archives.apache.org/mod_mbox/hbase-user/,201005
00669f8cc19ab008b4cb03f4e74bce0a,Multiwal performance with HBase 1.x,http://mail-archives.apache.org/mod_mbox/hbase-user/,201509
7dcf71840b7f053277a9714367da9bb9,connection loss for /hbase,http://mail-archives.apache.org/mod_mbox/hbase-user/,201106
2f9390569bd3d920078a967342f4bc38,can't start hbase in distributed mode in a single machine,http://mail-archives.apache.org/mod_mbox/hbase-user/,201406
e8dd1a7dd871b751b9db2e16fda40ad1,HBase dies shortly after starting.,http://mail-archives.apache.org/mod_mbox/hbase-user/,201206
f5216afd65f1d13bbc2d6416791b4460,hql error,http://mail-archives.apache.org/mod_mbox/hbase-user/,200805
8b6a7c3b4e399a39f861eb89c3dc2726,Hadoop 0.19.1 with -d64 option on Solaris 5.10 and java6 doesn't,http://mail-archives.apache.org/mod_mbox/hbase-user/,200905
787ec7c9e51992d6563894386c6287da,Hbase Installation,http://mail-archives.apache.org/mod_mbox/hbase-user/,200910
95635c22aa714faf62a88fe475d31cc3,hbase-0.94.7 doesn't support HDFS QJM HA,http://mail-archives.apache.org/mod_mbox/hbase-user/,201305
b906652fc0d11bee8e10b6615c4bff6e,Needed to restart HBase. Now Master won't start,http://mail-archives.apache.org/mod_mbox/hbase-user/,201309
53f07f43608a5651a56f8a4223b603fa,Java Client hangs after around 2 min,http://mail-archives.apache.org/mod_mbox/hbase-user/,201007
08e438489e3da25055bbc1a7dfc9069b,Region splits even when max Hstorefile is less then default value,http://mail-archives.apache.org/mod_mbox/hbase-user/,201403
b7db36a659e36a0701ac2fda1ff4f9f8,HBase High Availability,http://mail-archives.apache.org/mod_mbox/hbase-user/,200911
e7888d8b524c2294868ee48bff724510,HBase with HDFS - Setup problem,http://mail-archives.apache.org/mod_mbox/hbase-user/,200808
e49fa200b7a53d5fa734600a29cfd53b,HBase client with security,http://mail-archives.apache.org/mod_mbox/hbase-user/,201308
2743b3eac56b91df790bbcbc08b5ac7c,"possible resolution for ""unable to start hbase-0.20 rc2 due to",http://mail-archives.apache.org/mod_mbox/hbase-user/,200909
e51416dbe0cbdfefe24c94283489325b,HBase process not starting and uses a lot of CPU,http://mail-archives.apache.org/mod_mbox/hbase-user/,201512
b1d593776105774631b931088dc783f6,Region servers down when inserting with hbase0.20.0 rc,http://mail-archives.apache.org/mod_mbox/hbase-user/,200908
bb6b8a03666e61fdb221e6508219c414,regionserver not starting,http://mail-archives.apache.org/mod_mbox/hbase-user/,201204
76d18625fc0cdd4d89e22af21e4305dc,HBase backups,http://mail-archives.apache.org/mod_mbox/hbase-user/,200908
107c03dbf4eb0b278a2b2d828acafe98,Hbase Read/Write throughput measure,http://mail-archives.apache.org/mod_mbox/hbase-user/,201302
dccd9b30408c0830a2d2f6e3c4a98ced,Region server is getting disconnected and becomes unreachable.,http://mail-archives.apache.org/mod_mbox/hbase-user/,201308
b724479a63ac7a98f1c40d06e6749adb,Hbase copytable and export/import,http://mail-archives.apache.org/mod_mbox/hbase-user/,201108
2defb4962266c7ecea22286a216f02a3,What version of HDFS is compatible with HBase?,http://mail-archives.apache.org/mod_mbox/hbase-user/,201112
7b036393ea22c8ef5ed20eb57572f686,HBase is able to connect to ZooKeeper but the connection closes,http://mail-archives.apache.org/mod_mbox/hbase-user/,201206
8ffacd1336ea76910ad2407f57af78c2,Zookeeper hostname lookup,http://mail-archives.apache.org/mod_mbox/hbase-user/,200912
cb9a7e0c654c421c32e3efa7b8115af2,hbase/zookeeper,http://mail-archives.apache.org/mod_mbox/hbase-user/,200907
892125699ddf5f8f0f816a053bd6405f,Regionserver fails to serve region,http://mail-archives.apache.org/mod_mbox/hbase-user/,200810
dc417e0449b2b0beb02171ad435cd282,region max filesize,http://mail-archives.apache.org/mod_mbox/hbase-user/,201107
29060f70a8ed6647669336f2e98c551b,Problems Loading RegionObserver Coprocessor,http://mail-archives.apache.org/mod_mbox/hbase-user/,201205
e7692f55c97637ed51c03ab1f1077a64,Problem with starting HBase Master,http://mail-archives.apache.org/mod_mbox/hbase-user/,200903
6aa0b2e1ab2aa32759105cec730dbc7d,Issues on disabling compaction in HBase 0.94.2,http://mail-archives.apache.org/mod_mbox/hbase-user/,201211
d0840eff78542f606ccf1cf6fbdc3a3d,Hbase 0.98 not able to connect to Hadoop 2.4 running on VM,http://mail-archives.apache.org/mod_mbox/hbase-user/,201409
a1f77eeb385945c610c6b230bc9faa7e,Hbase installation.,http://mail-archives.apache.org/mod_mbox/hbase-user/,201207
96a1257e765b2603df8e558e3fbb4df2,is my hbase cluster overloaded?,http://mail-archives.apache.org/mod_mbox/hbase-user/,201404
aefd2a7f7385dcd6140a1622ed9e24a7,Merging regions,http://mail-archives.apache.org/mod_mbox/hbase-user/,201211
981990854d26753b19195fcc2c9f45d6,Cluster crash,http://mail-archives.apache.org/mod_mbox/hbase-user/,201104
b1105a0367627eee788d6201dc845b8a,How to install Snappy?,http://mail-archives.apache.org/mod_mbox/hbase-user/,201212
ac5e8e7bad7c5be8e2fdfaa939ae3bbe,Hbase setup on a single windows machine - running commands throws,http://mail-archives.apache.org/mod_mbox/hbase-user/,201012
c1edd9d87bca825a3ffb1be9ff53ca70,problem starting master with hbase 0.2.0,http://mail-archives.apache.org/mod_mbox/hbase-user/,200807
584d623942fa0a56f24e89be80e66e95,Remote Connection To Pseudo Distributed HBase (Deployed in aws ec2),http://mail-archives.apache.org/mod_mbox/hbase-user/,201304
eed8091e792d194e2ee49321c0723d5c,"Table listed in ""list"", but not in .META.",http://mail-archives.apache.org/mod_mbox/hbase-user/,201208
a1e6ae3a74aaaa9a9dfb0e485e9c1f84,map reduce range of records from hbase table,http://mail-archives.apache.org/mod_mbox/hbase-user/,200810
2710704a2eeee8914171783d9f73e0c9,Problem in using HBase Bulk Load,http://mail-archives.apache.org/mod_mbox/hbase-user/,201203
101bc7c3d573cc762412f1f97a923f54,zookeeper connection problem in pseudo mode,http://mail-archives.apache.org/mod_mbox/hbase-user/,201201
8d6b7aa550980d652eed1a84dbf85d32,HBase cracks on EC2,http://mail-archives.apache.org/mod_mbox/hbase-user/,200909
e6217bc33192d0a28dd6e901aa1dba30,problem starting Hbase 0.20 with Katta on EC2,http://mail-archives.apache.org/mod_mbox/hbase-user/,200908
c93fed4bfb8ae1afd51c49e1f2bb5638,problem in testing coprocessor endpoint,http://mail-archives.apache.org/mod_mbox/hbase-user/,201307
6cdab184e05698336051a0e10dc21c60,How do I test SampleRegionWALObserver?,http://mail-archives.apache.org/mod_mbox/hbase-user/,201210
0a9137c1935fb35e2ecb5644a7bb0b44,is there a way to verify whether deployed coprocessor is loaded.,http://mail-archives.apache.org/mod_mbox/hbase-user/,201507
67d6c47a46a35b2a330a11900ba95ff3,Lease Exception Errors When Running Heavy Map Reduce Job,http://mail-archives.apache.org/mod_mbox/hbase-user/,201308
053f31cd2cdf20f47ae205e777a3b225,Region server memory requirements,http://mail-archives.apache.org/mod_mbox/hbase-user/,200812
a91c39c7d417d3ea50fae5bd0d6e95f9,HBase client hangs after client-side OOM,http://mail-archives.apache.org/mod_mbox/hbase-user/,201408
1901e77a5e0dab66c69c81e0112b62d9,error in installing and starting hbase,http://mail-archives.apache.org/mod_mbox/hbase-user/,201410
f23305375a1884c6998a08070adf3470,Hbase Client problem,http://mail-archives.apache.org/mod_mbox/hbase-user/,200909
1ef8170d025c7ebd4df5d926afb63e57,hbase shell can't connect to server,http://mail-archives.apache.org/mod_mbox/hbase-user/,201403
86994a2c5a6c12b9fb5902e590e73049,NoSuchMethodError using zipkin with hbase 0.98.5,http://mail-archives.apache.org/mod_mbox/hbase-user/,201410
3e39644ca64f989e08cdc0eb85640d00,Help - can't start master server for HBase (pseudo-distributed mode).,http://mail-archives.apache.org/mod_mbox/hbase-user/,201209
1b74684685bca2ebf3bb6ed7d7521b7c,have you ever met this error?,http://mail-archives.apache.org/mod_mbox/hbase-user/,201307
a5749f04919366a2dba0941e865d06ad,Snapshots timeouts,http://mail-archives.apache.org/mod_mbox/hbase-user/,201404
99f07f8013011d8ef53f0a85a95e6f3d,Tune MapReduce over HBase to insert data,http://mail-archives.apache.org/mod_mbox/hbase-user/,201301
8935018b46f182e50b98fdb3769c2a18,Hbase on EC2 and issues with Amazon NAT Internal Addresses,http://mail-archives.apache.org/mod_mbox/hbase-user/,200901
787003522fde37fd46fdbbdf74f26a1b,Zookeeper config in 0.20.0,http://mail-archives.apache.org/mod_mbox/hbase-user/,200907
f21c6965fbbd013b0855e74d6760a979,regionservers in general and on EC2,http://mail-archives.apache.org/mod_mbox/hbase-user/,200910
a483e79f1bede4445597280bb8535eb2,Run the namenode and master seperately?,http://mail-archives.apache.org/mod_mbox/hbase-user/,201107
18e4becadebc6e97eb469ce39ab81c59,=?utf-8?Q?Re=3A_=E7=AD=94=E5=A4=8D=3A_how_config_multi_regionser?=,http://mail-archives.apache.org/mod_mbox/hbase-user/,201212
1fb85b5f587210379e6776c3fed4288a,unable to start hbase-0.20 rc2 due to zookeeper problem,http://mail-archives.apache.org/mod_mbox/hbase-user/,200908
d383895b3cbc22254100bec0cbdfb486,Access hbase remotely from java client,http://mail-archives.apache.org/mod_mbox/hbase-user/,201409
468fed1d9c5707ef8f247c5a2495b3ba,RegionServer unable to connect to master,http://mail-archives.apache.org/mod_mbox/hbase-user/,201401
23c25cd09a91ce2d17220650af776810,HBase 0.90.2 CDH3B4 -Compression algorithm 'lzo' previously failed,http://mail-archives.apache.org/mod_mbox/hbase-user/,201104
811946c96dafd28a0c10c5a92761bf73,None of my tables are showing up,http://mail-archives.apache.org/mod_mbox/hbase-user/,200910
9c5edaa0aa97ff67f5f6f177c0d97a6a,HBase crashes when one server goes down,http://mail-archives.apache.org/mod_mbox/hbase-user/,201102
594684d3567260f5a83449dd0560a444,RegionServer  unable to connect to master,http://mail-archives.apache.org/mod_mbox/hbase-user/,201112
78d221edee0b2c8691f2da2449126b21,hbase master retries to RS/DN,http://mail-archives.apache.org/mod_mbox/hbase-user/,201105
661160101eb079ab1b568583d89b2310,hbase 0.94.6.1 copytable (to 0.98.6 cdh 5.3.1 cloudera),http://mail-archives.apache.org/mod_mbox/hbase-user/,201503
605d1b2836a29012a3908330e4591f58,Is it possible to connect HBase remotely?,http://mail-archives.apache.org/mod_mbox/hbase-user/,201202
6bf2d27e8e2238c6e1c46f8d7a769454,how to develop a custom LoadBalancer for HBase,http://mail-archives.apache.org/mod_mbox/hbase-user/,201404
a1c06e50857736820a60b5e795124492,YCSB performance degradation with lzo,http://mail-archives.apache.org/mod_mbox/hbase-user/,201103
94209a8b87e947a5ae6bf8c8f57dc9a6,hadoop n hbase on ec2 cluster,http://mail-archives.apache.org/mod_mbox/hbase-user/,200904
9a44d22615fb32ca790073c203df641c,Connecting to standalone HBase from a remote client,http://mail-archives.apache.org/mod_mbox/hbase-user/,201211
f1c451a51d84e560d96d7ddb67d263dc,Setup hbase-0.20.0-candidate-2,http://mail-archives.apache.org/mod_mbox/hbase-user/,200908
d39e372b4d29c52cc5193e7a8ca427ca,Upgrade to 0.19.0,http://mail-archives.apache.org/mod_mbox/hbase-user/,200812
9f8a294b0275b3be53a5d4b0aa95f782,Hbase region server disconnecting with master after some time.,http://mail-archives.apache.org/mod_mbox/hbase-user/,201308
79a528883d0f5367a48e3d1be89a139a,Hbase import Tsv performance (slow import),http://mail-archives.apache.org/mod_mbox/hbase-user/,201210
88f508f075c33baebc77730fd970c43f,HBase 0.90.2 CDH3B4 - regions infinitely stuck in transition?,http://mail-archives.apache.org/mod_mbox/hbase-user/,201104
3c3815ced85166a15a67348f97458fbb,Hanging regionservers,http://mail-archives.apache.org/mod_mbox/hbase-user/,201007
de91747b4933cf0c50a9e6a3de77ecf8,HBase Failing on Large Loads,http://mail-archives.apache.org/mod_mbox/hbase-user/,200906
29702226b3cdc9fe94e56e76cf56e8b9,"hbase 0.20.6 - HBaseClusterTestCase, DU, cygwin, IntelliJ - arg!",http://mail-archives.apache.org/mod_mbox/hbase-user/,201101
e34dab1aefae488f454595c15a7358d3,error starting task tracker,http://mail-archives.apache.org/mod_mbox/hbase-user/,201203
816b308bea5255e8ada145578bdf4c29,Xceiver problem,http://mail-archives.apache.org/mod_mbox/hbase-user/,201011
c405fe11f15780f3ef9b9d0e639d8c8f,Htrace spans not generated for hbase client side code,http://mail-archives.apache.org/mod_mbox/hbase-user/,201507
724559a458f314b6c24bb4b8c28464ec,where does the client find the master ip,http://mail-archives.apache.org/mod_mbox/hbase-user/,200809
94117eca4c8462448b1eaa5f2343f5c0,How to set HBase to listen on aparticular IP,http://mail-archives.apache.org/mod_mbox/hbase-user/,201010
ba866464e1aa1680a0285ccfa2549e59,How to turn on tracing on HBase?,http://mail-archives.apache.org/mod_mbox/hbase-user/,201408
8f8384d9e17ef194f1c619b4714df0cc,HBase 0.94.3 with ACL RS won't start,http://mail-archives.apache.org/mod_mbox/hbase-user/,201406
722fbc40408f817c2cf347f27436422a,loss znode,http://mail-archives.apache.org/mod_mbox/hbase-user/,201212
02f3cf72943d4704e1e93900f9738076,Regionserver problems because of datanode timeouts,http://mail-archives.apache.org/mod_mbox/hbase-user/,201001
c100643e28ce6179de31382f5533c116,Tweaking HBase splits,http://mail-archives.apache.org/mod_mbox/hbase-user/,201105
49ba00d3807ee0d6767672a69f1656ba,All tables lost after reboot of one region server,http://mail-archives.apache.org/mod_mbox/hbase-user/,200902
8f56b5e76d999496dda254b69ef92936,hbase performance issue,http://mail-archives.apache.org/mod_mbox/hbase-user/,201203
c712947cb205ebc79f1b8f0483d4442d,HBase scan performance decreases over time.,http://mail-archives.apache.org/mod_mbox/hbase-user/,201211
6670c33454de7e6dda3589d06ccd26f7,hfile 9.4 to 9.6,http://mail-archives.apache.org/mod_mbox/hbase-user/,201407
23bbdc41d409db1e456889d1be501a3c,Unable to connect from windows desktop to HBase,http://mail-archives.apache.org/mod_mbox/hbase-user/,201304
c7fe2ea56c68ff238e7795e7524988bb,HBase client hangs after connecting to Zookeeper in pseudo-mode,http://mail-archives.apache.org/mod_mbox/hbase-user/,201303
fd2a5ed998dcb4d26f0b270e67ba167a,hbase cluster on EC2,http://mail-archives.apache.org/mod_mbox/hbase-user/,200901
8b181dc52c93e1b80ea29bb3237b1bb3,Region Servers going down frequently,http://mail-archives.apache.org/mod_mbox/hbase-user/,200904
652b9a7b1653ddf54ac1942ef2295a70,Region servers going down frequently (0.20 alpha),http://mail-archives.apache.org/mod_mbox/hbase-user/,200906
69b998e99ae72c7f64ef2b34548e3e9f,problem when change zookeeper.znode.parent,http://mail-archives.apache.org/mod_mbox/hbase-user/,201107
efef912de89ce796c3945d9766b4307f,problem in configuring hbase with hdfs,http://mail-archives.apache.org/mod_mbox/hbase-user/,200903
da63a3530bc8720cde450e037ce3196b,HBase Client connect to remote HBase,http://mail-archives.apache.org/mod_mbox/hbase-user/,201012
71baae0ead9147ce7f736f998234a212,hbase.bucketcache.percentage.in.combinedcache with ioengine=<FILE ON,http://mail-archives.apache.org/mod_mbox/hbase-user/,201510
9928cd2a8850e45e1f808efa21c7573d,Hbase first run problem,http://mail-archives.apache.org/mod_mbox/hbase-user/,200902
425536f5408adb68051cc64506c376bc,HBase Standalone Error,http://mail-archives.apache.org/mod_mbox/hbase-user/,201401
903af6befebeb3dede0b481e98c1d2de,hbase error,http://mail-archives.apache.org/mod_mbox/hbase-user/,201211
fa4fda5d68c51c2da6de01f0cf5e627c,HBase 0.94 security configurations,http://mail-archives.apache.org/mod_mbox/hbase-user/,201212
29dcfd724e407d0d8934f7462710bd40,failed to login,http://mail-archives.apache.org/mod_mbox/hbase-user/,201205
3656953dbd0c131a52591c167eaf1b85,.META error when I try to insert after truncating table,http://mail-archives.apache.org/mod_mbox/hbase-user/,200809
bf52b5821dc88d8bfb8529297dec22b2,Failed to create /hbase.... KeeperErrorCode = ConnectionLoss for,http://mail-archives.apache.org/mod_mbox/hbase-user/,201003
86c92fb22bb0db3a5d5049804097b0f1,hbase.cluster.distributed set to true but it says false,http://mail-archives.apache.org/mod_mbox/hbase-user/,201203
859f78258729d5f532baba5334b61b68,HBase went down,http://mail-archives.apache.org/mod_mbox/hbase-user/,201006
61ed9a69b1212b4d67cafa15875c1f5a,"Lost .META., lost tables",http://mail-archives.apache.org/mod_mbox/hbase-user/,201101
587f879ad2cd972dcfc215305da58ba2,Still need help with data upload into HBase,http://mail-archives.apache.org/mod_mbox/hbase-user/,200904
cb98bc56126b4d0265d1b158e81483f5,Regionserver won't start,http://mail-archives.apache.org/mod_mbox/hbase-user/,201503
9e7e3268b8f0d8471efb16599aa692d0,EC2 remote client woes,http://mail-archives.apache.org/mod_mbox/hbase-user/,201201
8a16789202a510eb2cbd1aa4e9f4ec50,RegionServer looking for ZooKeeper on 127.0.0.1,http://mail-archives.apache.org/mod_mbox/hbase-user/,201112
907ae9499e401a0552e5b044f331fdb3,=?UTF-8?B?UmU6IOetlOWkjTog562U5aSNOiBTaG91bGQgd2Ugc2V0IHRoZSBwcm9wZXJ0eSAiaGJhcw==?=,http://mail-archives.apache.org/mod_mbox/hbase-user/,201312
9871e04b270e44f8fad841efac770dc3,Data Local Questions,http://mail-archives.apache.org/mod_mbox/hbase-user/,201002
8abe5918f4ffd4c89317152b7a646803,HBase Random Read latency > 100ms,http://mail-archives.apache.org/mod_mbox/hbase-user/,201310
15efd1565417a513f65b526ae931d657,periodicFlusher get stuck,http://mail-archives.apache.org/mod_mbox/hbase-user/,201502
7f61d2f54a032564087475f29c81cc65,HBase / HDFS on EBS?,http://mail-archives.apache.org/mod_mbox/hbase-user/,201101
3754778171b5840ed397b65d4da60f26,HBase is not running.,http://mail-archives.apache.org/mod_mbox/hbase-user/,201304
29c15d147901f6065378e094e61437a8,Environment variables in the configuration xml's,http://mail-archives.apache.org/mod_mbox/hbase-user/,201202
aeb971b00de758b51f7d1317d5ae8056,ClockOutOfSyncException with zookeeper,http://mail-archives.apache.org/mod_mbox/hbase-user/,201105
4023e3039383db9bb613cafa7c6a3c2a,UnknownScannerException,http://mail-archives.apache.org/mod_mbox/hbase-user/,201003
c807355062a4c93589fb8efca30d7002,Failed to start master with HBase 0.94.2 on Hadoop 1.0.4,http://mail-archives.apache.org/mod_mbox/hbase-user/,201211
dad9c3661a06a31237d108b086eba3d2,mapreduce runs locally,http://mail-archives.apache.org/mod_mbox/hbase-user/,200807
ee30a5c554846870f89260e809c64d1b,Ec2 instability,http://mail-archives.apache.org/mod_mbox/hbase-user/,200904
ff3b93e393a1d518f8437b7e0dedce98,NoClassDefFoundError when running Hadoop with HBase,http://mail-archives.apache.org/mod_mbox/hbase-user/,201201
e7b2df4048d221be011ccb0f83825b60,Which parameter control the regions split size?,http://mail-archives.apache.org/mod_mbox/hbase-user/,201008
1c0c61162047c4502414228cab6d4b96,hbase.zookeeper.quorum minimum nodes ?,http://mail-archives.apache.org/mod_mbox/hbase-user/,201310
94c6a328ee35143ce298cd0d98c7add3,DataXceiver java.io.InterruptedIOException error on scannning Hbase,http://mail-archives.apache.org/mod_mbox/hbase-user/,201405
265d15654b41663b5587447509f0bc10,Data Loss During Bulk Load,http://mail-archives.apache.org/mod_mbox/hbase-user/,201003
4ebc4bbdeeaf28f92651cd6ddcb47c15,Doubt at hbase configuration,http://mail-archives.apache.org/mod_mbox/hbase-user/,201203
eaa75a98bc30abc34da32f4acaf0394b,General question regarding the hbase-site.xml file,http://mail-archives.apache.org/mod_mbox/hbase-user/,201004
7ebeeed3d9fc58e1e266e637c872f61d,Table with 80 regions having nearly no data in it,http://mail-archives.apache.org/mod_mbox/hbase-user/,200812
90ae12f29634a3f577315e480a8d0221,hbase regions behaving badly,http://mail-archives.apache.org/mod_mbox/hbase-user/,201511
9441241f7659dd1478e0df37f99e8c36,High ingest rate and FIN_WAIT1 problems,http://mail-archives.apache.org/mod_mbox/hbase-user/,201007
2e2c841d0056e0d19953b41c4716926b,Performance become slower and slower during inserting,http://mail-archives.apache.org/mod_mbox/hbase-user/,200903
1df834bafa277ddecd9818436da99767,issue about two hbase on same hadoop cluster,http://mail-archives.apache.org/mod_mbox/hbase-user/,201406
d543eedf0f85ce5b0a6f20ea4ec1ad00,Problems with region server OOME,http://mail-archives.apache.org/mod_mbox/hbase-user/,201003
66a978b3630ea8e46bbc3e051c837e62,Running HBase on Windows,http://mail-archives.apache.org/mod_mbox/hbase-user/,200805
1dd84b1fae7ba80de7a2f9b570c9f9fb,Zookeeper available but no active master location found,http://mail-archives.apache.org/mod_mbox/hbase-user/,201204
5681b0c6cb0acd6d377fd7f59e84bef6,Zoo keeper exception in the middle of MR,http://mail-archives.apache.org/mod_mbox/hbase-user/,201012
e3af9c9d6a0d97a08ac02823a873b346,Table Upload Optimization,http://mail-archives.apache.org/mod_mbox/hbase-user/,200910
edf5f6bef754d04275ffe248569dd526,Question to speaker (tab file loading) at yesterdays user group,http://mail-archives.apache.org/mod_mbox/hbase-user/,200901
fa17f0303dbc36b2bd3fb4f6c8ef36b9,can not enable snapshot function on hbase 0.94.6,http://mail-archives.apache.org/mod_mbox/hbase-user/,201410
a10bfacf6efb48bc3fbf19c8ee661e97,What cause region server to timeout other than long gc?,http://mail-archives.apache.org/mod_mbox/hbase-user/,201310
c051f314e4e1540f0de8c33d95eaa2a0,hbase.tmp dir property not working,http://mail-archives.apache.org/mod_mbox/hbase-user/,201108
a6f60c19f08f8ad5c64102a0e489f626,Hbase pseudo distributed setup not starting,http://mail-archives.apache.org/mod_mbox/hbase-user/,201306
6a632386d7aed98b60bbdd4907910477,CleanerChore exception,http://mail-archives.apache.org/mod_mbox/hbase-user/,201212
6eb55be789deced6ec7c6a096dd311fc,what is the recommended configuration in hbase to write big data,http://mail-archives.apache.org/mod_mbox/hbase-user/,201106
84420427c3f796882fb9f293d6ce1f41,"Should we set the property ""hbase.local.dir"" to a list of directories",http://mail-archives.apache.org/mod_mbox/hbase-user/,201312
599865392f325bce866d7cd6ec68fe25,global memcache limit of 396.9m exceeded cause forcing server,http://mail-archives.apache.org/mod_mbox/hbase-user/,200902
1810a0163779c3b5d00febe936224f1e,Read thruput,http://mail-archives.apache.org/mod_mbox/hbase-user/,201304
0a06957048d5b0584a0a1dc9e7066cf1,Should I close HTable,http://mail-archives.apache.org/mod_mbox/hbase-user/,201002
1467fbf1b0cbfb3875f325156c28216a,Starting HBase in fully distributed mode...,http://mail-archives.apache.org/mod_mbox/hbase-user/,200912
818dc99d2d3623f9c700f6e7c9f4bb45,=?GB2312?Q?Re=3A_=B4=F0=B8=B4=3A_Should_we_set_the_property_=22hbase=2Elocal=2E?=,http://mail-archives.apache.org/mod_mbox/hbase-user/,201312
6cfea0f5d1cb945c8d811106df7393fe,0.89 Regionserver outage behaviors,http://mail-archives.apache.org/mod_mbox/hbase-user/,201010
69df21a0d8001b9e4aa8e492dfa931c4,Region autoSplit when not reach 'hbase.hregion.max.filesize' ?,http://mail-archives.apache.org/mod_mbox/hbase-user/,201206
d030b164ae7cb5633c814a2c607d8513,HBase Issues (perhaps related to 127.0.0.1),http://mail-archives.apache.org/mod_mbox/hbase-user/,201211
860f6d48f67524fe1e4c4eea30991719,Way to Specify HBase master?,http://mail-archives.apache.org/mod_mbox/hbase-user/,200911
