FILENAME,THREAD,MAIL ARCHIVAL,DATE
0ff42be5403081a7c83d667a3eae2671,Are transactional indexes and indexed indexes incompatible?,http://mail-archives.apache.org/mod_mbox/hbase-user/,201003
d47605d0c3f874eba8cdd0a8b50d01ae,Newb sees exception in logs after fresh install,http://mail-archives.apache.org/mod_mbox/hbase-user/,201502
e88c6df518cda4d81bce1336eea5b836,Using MiniHBaseCluster in Maven Tests with LZO,http://mail-archives.apache.org/mod_mbox/hbase-user/,201105
9b45029b4e813adc6ede0aca6c793577,HBase Startup Errors,http://mail-archives.apache.org/mod_mbox/hbase-user/,200802
9029c1b94532f547a16abd918e0bb2a1,Install hbase on Ubuntu 11.10,http://mail-archives.apache.org/mod_mbox/hbase-user/,201203
4dcd8473d3d8c6e4728043e51aa2eff9,Problem using HBaseTestingUtility,http://mail-archives.apache.org/mod_mbox/hbase-user/,201010
c070c3d4bd06b251a81cd3ffe02dbf1a,Set hbase configuration when client is on different machine,http://mail-archives.apache.org/mod_mbox/hbase-user/,200905
f60975308e564f086c3e609e1e7e9825,RegionServer 60030 Show All RPC Handler Task is empty,http://mail-archives.apache.org/mod_mbox/hbase-user/,201506
ca68a27bf6e3c3d8e86d90f06daf5d0a,Region server shutdown during writes (bad data nodes),http://mail-archives.apache.org/mod_mbox/hbase-user/,201102
95d88b1464cd69ed9649799f33ae0db8,Problems with HBase JMX beans,http://mail-archives.apache.org/mod_mbox/hbase-user/,201212
616b3364d7ac5e194349f2c36b47e2ce,Master binds only to loopback,http://mail-archives.apache.org/mod_mbox/hbase-user/,201003
18cad6ab9efbbbb483d98f6a55469ed8,Zookeeper Error,http://mail-archives.apache.org/mod_mbox/hbase-user/,200910
f690e3c234ed770be4e2ec86a6d1660c,hbase.client.ipc.pool.size problem with hbase 0.95.1,http://mail-archives.apache.org/mod_mbox/hbase-user/,201306
00b93ac06a556bb5e647173a24c7b908,HBase reading test,http://mail-archives.apache.org/mod_mbox/hbase-user/,201001
4b44a086aa2df8f5b7b1aef66431fbe0,example - hbase-site.xml - fully distributed,http://mail-archives.apache.org/mod_mbox/hbase-user/,201209
41f683b1299a05790f4a88faa4ba8770,Region Servers Crashing - LeaseExpired,http://mail-archives.apache.org/mod_mbox/hbase-user/,201012
6477653eb8557282ea502f3078a61614,How to validate HBase configuration (for region servers) from HBase,http://mail-archives.apache.org/mod_mbox/hbase-user/,201407
f4dc16d98f1dee4c9df85c928db0d4b3,Data lost during intensive writes,http://mail-archives.apache.org/mod_mbox/hbase-user/,200903
96a2ce831350fa653771c03c2a4cd360,Row Counter rpoblem,http://mail-archives.apache.org/mod_mbox/hbase-user/,201206
ae8aa6966a287beb9546927069e39ec5,Optional memstore flush,http://mail-archives.apache.org/mod_mbox/hbase-user/,200909
0ee11f02ba8d941abca1d779c4f323a5,AccessDeniedException on the regionserver with security enabled,http://mail-archives.apache.org/mod_mbox/hbase-user/,201209
a9cfdffc9df17006108e22fab6e98af2,Importing to HBase from Java problem,http://mail-archives.apache.org/mod_mbox/hbase-user/,201012
5de61b7c0b5518b6d54ae836ec41215e,cannot connect with hbase client,http://mail-archives.apache.org/mod_mbox/hbase-user/,200903
aeb98d1663a458abe3b50f4098179db2,0.90.1 HMaster malfunction in pseudo-distributed mode,http://mail-archives.apache.org/mod_mbox/hbase-user/,201105
59e8fcc5c8cdafe28aa8499b070e0409,HBase cluster -- 2 machines -- ZooKeeper problems when launching jobs,http://mail-archives.apache.org/mod_mbox/hbase-user/,200908
97540b96f86c23dc496abafb940cef34,Hbase data directory not recognizing hadoop's hbase.rootdir,http://mail-archives.apache.org/mod_mbox/hbase-user/,201004
79c1dc6e7cc10ca8c65878281c998cfb,HBase in a real world application,http://mail-archives.apache.org/mod_mbox/hbase-user/,200908
971f02ff907dfc90295704e09fb8f1c0,want to try HBase on a large cluster running Lustre - any advice?,http://mail-archives.apache.org/mod_mbox/hbase-user/,201112
e702c65fdee05a0359da799f4a632188,UnknownHostException,http://mail-archives.apache.org/mod_mbox/hbase-user/,200809
43a7cdc940a384122d75796603a57f33,error when starting hbase,http://mail-archives.apache.org/mod_mbox/hbase-user/,201304
fa0e27c4c1e8c29ac273c1c6ad765fef,Difficulty in use Hbase fully distributed mode,http://mail-archives.apache.org/mod_mbox/hbase-user/,201107
59c648f9a3a5c5cc5aa06fcc7dd813c5,=?UTF-8?B?UmU6IOetlOWkjTogaG93IGNvbmZpZyBtdWx0aSByZWdpb25zZXJ2ZXIsIG9yIHdoYXQgaQ==?=,http://mail-archives.apache.org/mod_mbox/hbase-user/,201212
741950ec307a767c54732eff75a01ccf,Problem in host resolving,http://mail-archives.apache.org/mod_mbox/hbase-user/,201111
156cb7992e8162fd804905bd0b83cbdf,Enabling IHbase,http://mail-archives.apache.org/mod_mbox/hbase-user/,201005
2cb52d4a0d968acbe38f10deb647a67f,LeaseException,http://mail-archives.apache.org/mod_mbox/hbase-user/,201207
2320149008cc0272166547e4b869cfbc,HBase 0.20.0 alpha not starting in distributed mode,http://mail-archives.apache.org/mod_mbox/hbase-user/,200906
90f2504c276feaef85a4b362cf8c5eb3,Performance at large number of regions/node,http://mail-archives.apache.org/mod_mbox/hbase-user/,201005
b9e5d68458138d74fc4d47a0cf13758c,"Too many ""Compaction Complete"" messages",http://mail-archives.apache.org/mod_mbox/hbase-user/,201309
0e56e2556fb9ad9edba6921640c9c645,Snapshot Timing Out on a Large HBase Table,http://mail-archives.apache.org/mod_mbox/hbase-user/,201505
1547a5eb843c4773ef3fa2c94e1da857,Unexpected behaviour when VisibilityController coprocessor is used,http://mail-archives.apache.org/mod_mbox/hbase-user/,201510
8bc9b8182ec643651c9d25f175a0eb93,Exception when scanning table,http://mail-archives.apache.org/mod_mbox/hbase-user/,200902
93a352126dc70403d44fe609671ce8eb,A region server stopped (timeout after trying to connect local,http://mail-archives.apache.org/mod_mbox/hbase-user/,201211
4bc608927a1b2163c88b4e3e9f9bb8c0,Coprocessor execution with bulk data,http://mail-archives.apache.org/mod_mbox/hbase-user/,201203
7b33882ca6a62c2c526caff8b09f12e0,problem in starting in Hbase,http://mail-archives.apache.org/mod_mbox/hbase-user/,201110
3929ecbee838153d3ab607b94b20a419,HBase client query,http://mail-archives.apache.org/mod_mbox/hbase-user/,200910
be97cf37be21764b47b0160d81c21770,how to set mapred.system.dir?,http://mail-archives.apache.org/mod_mbox/hbase-user/,201109
32fcd9809e051dc8d05853f98e3260fa,Help with NPE during bulk load (completebulkload),http://mail-archives.apache.org/mod_mbox/hbase-user/,201104
626ea34cd6b7382d8e46b944d7f49e7e,Dataloss HBASE-728,http://mail-archives.apache.org/mod_mbox/hbase-user/,200810
18c2d27a8b8704a70848397f20a1774d,Handling regionserver crashes in production cluster,http://mail-archives.apache.org/mod_mbox/hbase-user/,201306
ec998c1a60ac3bbe4c922a959bfd66da,HBase 0.98.1 split policy change?,http://mail-archives.apache.org/mod_mbox/hbase-user/,201404
9df3bd3e5cb4869c9cee33497fc89e08,how to explain read/write performance change after modifying the,http://mail-archives.apache.org/mod_mbox/hbase-user/,201411
b046c2b8ea91d8bba489ae580b2b3b7e,Starting 0.20.0 - configuration problem?,http://mail-archives.apache.org/mod_mbox/hbase-user/,200907
c07ea1ed9cdfc776f015a0fb1cc66c9b,Need some help diagnosing poor performance (long),http://mail-archives.apache.org/mod_mbox/hbase-user/,200809
e344d2165ff886be611c0d5d3d2d480e,hbase.cluster.distributed property in hbase-site.xml,http://mail-archives.apache.org/mod_mbox/hbase-user/,201308
3df412b4b3cfb32c757fdaa9fc7437c5,DataXceiver java.io.EOFException,http://mail-archives.apache.org/mod_mbox/hbase-user/,201211
4d65795ca61406e81f506dcbc5b666c5,Dynamic load of Coprocessors,http://mail-archives.apache.org/mod_mbox/hbase-user/,201206
001e5aeb45b36e742c4e94dcea09b76f,Region Server on EC2,http://mail-archives.apache.org/mod_mbox/hbase-user/,200909
d50364f13c8a4b6071317ed6affcea5d,is there anyway to turn off compaction in hbase,http://mail-archives.apache.org/mod_mbox/hbase-user/,201208
56a54608a7cbd3db132b28a19d1385d7,=?gb2312?B?tPC4tDogtPC4tDogSG93IHRvIGFkanVzdCBoYmFzZSBzZXR0aW5ncw==?=,http://mail-archives.apache.org/mod_mbox/hbase-user/,201210
294324563c2905be95031ffc2807e5f0,Region server goes away,http://mail-archives.apache.org/mod_mbox/hbase-user/,201004
69dfca25b4d652ba520e20a80e68c69e,major compaction best practice,http://mail-archives.apache.org/mod_mbox/hbase-user/,201105
e54c6bbd4cfc1693ace0598e19284515,IO Exception on startup,http://mail-archives.apache.org/mod_mbox/hbase-user/,200912
55a859a058c6acd942c2a304362b5003,Problems running hbase on dfs,http://mail-archives.apache.org/mod_mbox/hbase-user/,200811
da94372ad366d1204fe746d1d955fee1,BucketCache Configuration,http://mail-archives.apache.org/mod_mbox/hbase-user/,201407
88668b7a110a916c748434fdc3c38a8e,Tables & rows disappear,http://mail-archives.apache.org/mod_mbox/hbase-user/,201101
da1341fc0857ccb04fb778d097235748,Restoring HBase from backup,http://mail-archives.apache.org/mod_mbox/hbase-user/,201409
05cfe6ed05491d65198876726d832cd6,How to set number of mappers when using HBaseStorage,http://mail-archives.apache.org/mod_mbox/hbase-user/,201405
499c817bb8fd90588c61e6d5263c39f3,Problem with HBase and HDFS,http://mail-archives.apache.org/mod_mbox/hbase-user/,200901
33a7878bbf7d8a67c438a7f46536b3a2,HBase region server id problem with ipv6 address,http://mail-archives.apache.org/mod_mbox/hbase-user/,200804
e7d962d24cb5b1b064b1d7c974d6c415,Cannot find row in .META. for table,http://mail-archives.apache.org/mod_mbox/hbase-user/,201403
8e3b819701b7788c871c3ca77a861eda,Zookeeper exceptions while starting up region,http://mail-archives.apache.org/mod_mbox/hbase-user/,201007
d38aed0e68322d5b93452c89b55d0d99,hbase updgrade,http://mail-archives.apache.org/mod_mbox/hbase-user/,200902
03081ecac7fa8bbb66016c5855c5e0e5,anyway to turn off per-region metrics?,http://mail-archives.apache.org/mod_mbox/hbase-user/,201307
caa275b7d3278c09eee31d30e2f5d40d,Scan got exception,http://mail-archives.apache.org/mod_mbox/hbase-user/,201506
ce3b43ae2e810c7d945d665cf1db8810,hbase master is not starting @ 60010 on new ubutnu 11.04 system,http://mail-archives.apache.org/mod_mbox/hbase-user/,201112
c26e52a36a5e0884a8de45ec853e582e,hbase-site.xml property placeholder,http://mail-archives.apache.org/mod_mbox/hbase-user/,201110
83be110ed19f8bbd31e687fdf58474ed,"Exception in thread ""main""",http://mail-archives.apache.org/mod_mbox/hbase-user/,201102
93bef5d11727a0e2574659ce7a152bd3,How do I trigger multiple Mapper tasks?,http://mail-archives.apache.org/mod_mbox/hbase-user/,201001
85dfe6cc879730aeb37adfbfc383293a,Internals of HBase shell to connect with a secure HBase cluster,http://mail-archives.apache.org/mod_mbox/hbase-user/,201309
3ba8c3f646e3959d3713a47135eeddc4,hbase error caused by DFS timeout,http://mail-archives.apache.org/mod_mbox/hbase-user/,201008
acea929a0615c9f2851c71f44f4f8e4a,hbase/.archive doesn't exist,http://mail-archives.apache.org/mod_mbox/hbase-user/,201303
feee9930c2c86b567442c1b86977ef10,Does hbase.hregion.max.filesize have a limit?,http://mail-archives.apache.org/mod_mbox/hbase-user/,201211
265d765704bf33a9111b49ea6d9ca4c4,Hadoop pipes with Hbase as input,http://mail-archives.apache.org/mod_mbox/hbase-user/,201208
68d4e0167ce13a899fe6075068d51067,"Solved - Question on Hbase 0.89 - interactive shell works, programs",http://mail-archives.apache.org/mod_mbox/hbase-user/,201009
ff3143cbc0fc7703d9c411ada12d6639,RAM Problems - Keeps Crashing,http://mail-archives.apache.org/mod_mbox/hbase-user/,201112
2e6c88df90392777fe089b6ab6a67019,Minor compacts seem blocked on major compacts,http://mail-archives.apache.org/mod_mbox/hbase-user/,201510
dae7f30cee6f38062dd94b3f54d18c38,distributed cluster proble,http://mail-archives.apache.org/mod_mbox/hbase-user/,201203
8552af0c5d7ddf01c007e9f9056f7745,Exception starting HBase,http://mail-archives.apache.org/mod_mbox/hbase-user/,201201
6f6687bd004d0ac94df7fe3eca787627,hbase on s3 and safemode,http://mail-archives.apache.org/mod_mbox/hbase-user/,200910
1a4817e5c659842f319e98d9b52f2259,Exception when running HBase from Hadoop 0.16 package -,http://mail-archives.apache.org/mod_mbox/hbase-user/,200802
bc3f577b8bff1eaa80532e3e7147f3e8,HBase and Hadoop 0.20-security-append,http://mail-archives.apache.org/mod_mbox/hbase-user/,201107
0261ce61f9f91cfce8cde3fc1798d505,Loading data from Hive to HBase takes too long,http://mail-archives.apache.org/mod_mbox/hbase-user/,201308
cb5e8bea284361817e4aa937cb8cad62,Capacity planning,http://mail-archives.apache.org/mod_mbox/hbase-user/,200910
0f480f3c12c80cd4d64b424085e4086f,Can Hbase run on NFS cluster,http://mail-archives.apache.org/mod_mbox/hbase-user/,201212
720844aadf3796a76597fde4e0460193,HBase went down during insertion test,http://mail-archives.apache.org/mod_mbox/hbase-user/,200808
da7902f51811c6676e12d98d34525ad8,HBASE 0.90.4 and indexing,http://mail-archives.apache.org/mod_mbox/hbase-user/,201111
badbfbe1ed889e8c293eda3dbe85fb12,zookeeper/mapred problems,http://mail-archives.apache.org/mod_mbox/hbase-user/,201102
0e9b766f4780fbf8858b68f3cb54aa91,Advice on setting default HBase table mapping attributes within,http://mail-archives.apache.org/mod_mbox/hbase-user/,201305
c1c914a6bafb6d3c3dd760d9e5c170c6,regions are not getting distributed,http://mail-archives.apache.org/mod_mbox/hbase-user/,201308
77b65ad32be6a7f53188fdf10da5a52f,ideas to improve throughput of the base writting,http://mail-archives.apache.org/mod_mbox/hbase-user/,201006
d13bd02a0c6afbd7df2d58187e977d20,0.92 and Read/writes not scaling,http://mail-archives.apache.org/mod_mbox/hbase-user/,201203
63b0fcc27ab681bfe0fef2fe15618e26,Cannot start HBase master with HDFS,http://mail-archives.apache.org/mod_mbox/hbase-user/,200807
bd19e54001ddd167ff72dcf2113dcdcd,org.apache.hadoop.util.PureJavaCrc32C not available,http://mail-archives.apache.org/mod_mbox/hbase-user/,201210
b5d20df79e18b400daf7038d30c13cbc,too many regions cause OME ?,http://mail-archives.apache.org/mod_mbox/hbase-user/,201104
83691b6b07425f0c07d946c6e77349d7,HBase Master cannot be contacted by Region Servers,http://mail-archives.apache.org/mod_mbox/hbase-user/,201407
8c340dc334134096f68b880b42a8692c,Replication,http://mail-archives.apache.org/mod_mbox/hbase-user/,201007
0db0121890a0f7e0980e17e403ab3f21,Storing images in Hbase,http://mail-archives.apache.org/mod_mbox/hbase-user/,201301
398a5b339b6d023c29816bb7b3683e55,HBase Client Concerns,http://mail-archives.apache.org/mod_mbox/hbase-user/,200909
260f2b51822592727aa9d5631d228fae,hdfs /DN errors,http://mail-archives.apache.org/mod_mbox/hbase-user/,201103
1858de457f782da4cdcbd558316eccd8,hbase.hregion.majorcompaction not taking effect.,http://mail-archives.apache.org/mod_mbox/hbase-user/,201302
9ba6a2d9866bd2e214b3cc4fade4f417,zookeeper configuration,http://mail-archives.apache.org/mod_mbox/hbase-user/,200910
d57efb982b7e8cfcccbdb1950e2c4334,DFSClient errors during massive HBase load,http://mail-archives.apache.org/mod_mbox/hbase-user/,201004
eca985f073173e831cf34b2299b924f3,Location of HBase's database (database' s files) on the hard disk,http://mail-archives.apache.org/mod_mbox/hbase-user/,200908
b09bee7b6ec5bd1e1d3767a7731cb22e,HBase Clustering,http://mail-archives.apache.org/mod_mbox/hbase-user/,201209
1fd8833f6e42125af596122f509be092,Force the number of map tasks in MR?,http://mail-archives.apache.org/mod_mbox/hbase-user/,201210
66e7e8e338ac7f4185021b4f132bb115,split table data into two or more tables,http://mail-archives.apache.org/mod_mbox/hbase-user/,201302
f990a460676622a61c630b4e970f0508,Regionservers crash with an OutOfMemoryException after a,http://mail-archives.apache.org/mod_mbox/hbase-user/,201005
4ff718e5ef311e6789da68a215daf30a,s3/s3n working or not working??,http://mail-archives.apache.org/mod_mbox/hbase-user/,201111
6668cfdf674be6430e3e01dddbee690d,Manage Major Compaction.,http://mail-archives.apache.org/mod_mbox/hbase-user/,201309
1c4abeb79048c4adce81e5fd2f5a20e2,RPC Client OutOfMemoryError Java Heap Space,http://mail-archives.apache.org/mod_mbox/hbase-user/,201405
e95a073b8799610b481efa36f9bb271c,how to recover hbase,http://mail-archives.apache.org/mod_mbox/hbase-user/,201006
7b16e4cdaf36d7d5ee21b8e9b633855d,try to run PerformanceEvaluation and encounter,http://mail-archives.apache.org/mod_mbox/hbase-user/,200903
b8fe26e49796b36e200064739341d5b6,Running two instances of Hbase on a single node,http://mail-archives.apache.org/mod_mbox/hbase-user/,200911
b56dff38a64a3330acfa263668e251b9,HBase memstore flush configurations,http://mail-archives.apache.org/mod_mbox/hbase-user/,201505
ecda73410dde2d2837ab114f72189c52,why is hbase creating this mapred directory on hdfs??,http://mail-archives.apache.org/mod_mbox/hbase-user/,201101
1e3db882bc32a8cfde511c38f86427a3,how to check whether zookeeper quorum is working fine or not ?,http://mail-archives.apache.org/mod_mbox/hbase-user/,201107
058e10339850b07ba61c35c785d048d9,Install HBase on hadoop-2.2.0,http://mail-archives.apache.org/mod_mbox/hbase-user/,201310
c2a6c53a9b0a1630cdad6f2409a4ac95,Slow region moves,http://mail-archives.apache.org/mod_mbox/hbase-user/,201510
366a90b0817ed2dc8eadf06a2d758f76,hbase with multiple interfaces,http://mail-archives.apache.org/mod_mbox/hbase-user/,201004
08f614b8f69ecc9f746f621963069868,hbase/hadoop config(do I need to change /etc/hosts???)-still getting,http://mail-archives.apache.org/mod_mbox/hbase-user/,201012
5e8c97510683fa032746b86c58baf0ee,Access remote HBase server with different user names,http://mail-archives.apache.org/mod_mbox/hbase-user/,201211
b5da5a282d58a628bfbc640cf6c4779d,Hbase pausing problems,http://mail-archives.apache.org/mod_mbox/hbase-user/,201001
ba7e1475e3fb6ea91bf1dca0109eda75,How to move table data from hbase 0.94 to 0.96 use,http://mail-archives.apache.org/mod_mbox/hbase-user/,201407
5d837f613b0a701bb05c09ed97b241ce,dfs.data.dir - hbase and hadoop,http://mail-archives.apache.org/mod_mbox/hbase-user/,201012
9c2b3943faeb4b91f437f758d8d85344,Disk space usage of HFilev1 vs HFilev2,http://mail-archives.apache.org/mod_mbox/hbase-user/,201208
01e6905bfc03336659322347f729e16c,Exception on startup -ClassNotFound-,http://mail-archives.apache.org/mod_mbox/hbase-user/,200912
b3403d1983877b1888595762096709fc,"Slow mapreduce using Hbase , regardless on number of machines",http://mail-archives.apache.org/mod_mbox/hbase-user/,200807
cdaa96ff28d4aa7f37cc38239665b3d1,Can't connect to master,http://mail-archives.apache.org/mod_mbox/hbase-user/,201007
e67f9d589faf516fd9e368a2f3b6e3ec,Initial region loads in hbase..,http://mail-archives.apache.org/mod_mbox/hbase-user/,201008
5fe6ef3d83a351d26b26e3d52599b47e,zookeeper quorum verification,http://mail-archives.apache.org/mod_mbox/hbase-user/,201111
bd6687c853a37928c8932d46ad3527ee,HBase-Hive integration performance issues,http://mail-archives.apache.org/mod_mbox/hbase-user/,201308
fdc69f4ee66bf24b9e14e01725a98420,hbase from trunk trunk failed ...,http://mail-archives.apache.org/mod_mbox/hbase-user/,200901
0ea8461d1a39a54010a09d8c01b41214,hbase insert performance test (from hbasemaster and regionservers),http://mail-archives.apache.org/mod_mbox/hbase-user/,201205
7432b129ada2fa79b72bc80a4dce31b1,Hbase clustering,http://mail-archives.apache.org/mod_mbox/hbase-user/,201209
23172729c92324affbde5b4a332fdd73,Co-processor seems to be failing to load,http://mail-archives.apache.org/mod_mbox/hbase-user/,201210
7556f806a62065498488b006ce4e6c46,HBase Support,http://mail-archives.apache.org/mod_mbox/hbase-user/,201305
1760e3c1d5b09c525cd4ec5c7840610e,Java client connection to HBase 0.20.1 problem,http://mail-archives.apache.org/mod_mbox/hbase-user/,200911
222f1e6e81982679b2d89a4dae6d9ffc,HBase failing to restart in single-user mode,http://mail-archives.apache.org/mod_mbox/hbase-user/,201505
82dc12cd2b64a7694d67c7e7073d341e,mapred timeout,http://mail-archives.apache.org/mod_mbox/hbase-user/,200902
90f797e119edc70a2fa3fbcc285b9e9f,connecting Hbase using java,http://mail-archives.apache.org/mod_mbox/hbase-user/,201303
21de14f58f68ba13498cd6bda0a71813,Starting Abnormally After Shutting Down For Some Time,http://mail-archives.apache.org/mod_mbox/hbase-user/,201203
504f7426f606020ab8a3774f0e17860a,Cannot open filename Exceptions,http://mail-archives.apache.org/mod_mbox/hbase-user/,201003
7c5e545d72a95ca9bb020973e513fdc6,hbase host dns ip and route for multi network interface card,http://mail-archives.apache.org/mod_mbox/hbase-user/,201107
ab26f0a5236d066c5ff1bb3e36ffe17b,HBase connectivity issue,http://mail-archives.apache.org/mod_mbox/hbase-user/,201405
eb1f0548bcfd7aa66a052ceebb46547c,Can not access HBase Shell.,http://mail-archives.apache.org/mod_mbox/hbase-user/,201209
a6c717f7b2355f1882ee93ee143c2f57,I can't start cluster due to zookeeper,http://mail-archives.apache.org/mod_mbox/hbase-user/,201504
6a69579bf327634802bdfda3405eaea8,Trouble with s3n/s3,http://mail-archives.apache.org/mod_mbox/hbase-user/,201111
b0deaadd05cea31ef61b604e3f6f0508,RegionServer dying every two or three days,http://mail-archives.apache.org/mod_mbox/hbase-user/,201112
33443d804d92f4463980a84ebae23fe7,Multiple directories for hadoop,http://mail-archives.apache.org/mod_mbox/hbase-user/,201101
0dbb2ad64d63e5f827e6d9462e0fa1d5,What is the impact on RegionServer Crash?,http://mail-archives.apache.org/mod_mbox/hbase-user/,200810
3f57847a9cbc177b38e2bfd027885fa5,NoSuchColumnFamilyException with rowcounter,http://mail-archives.apache.org/mod_mbox/hbase-user/,201210
25a1869ae7b530473b7eafa930172acf,HBase - Zookeeper Error.,http://mail-archives.apache.org/mod_mbox/hbase-user/,201412
686aff549ea8c133ad9191731d33a69c,flushing + compactions after config change,http://mail-archives.apache.org/mod_mbox/hbase-user/,201306
b0746fe08d657d47d4b4ecbc881a6ea4,HRegionServer failed due to replication,http://mail-archives.apache.org/mod_mbox/hbase-user/,201510
1ca74031f9e44b8f4ed6c48fa70dccf5,Snapshot failure,http://mail-archives.apache.org/mod_mbox/hbase-user/,201409
8c37944aa8a10c258330808fbe3a4513,Will hbase automatically distribute the data across region servers or,http://mail-archives.apache.org/mod_mbox/hbase-user/,201308
fbd8fd633ef1fd701aefdf328617bcd3,zookeeper can't connect,http://mail-archives.apache.org/mod_mbox/hbase-user/,201101
9e317d736656d6a99f126fcb4fd958ad,Why does throw java.io.IOException when I run a job?,http://mail-archives.apache.org/mod_mbox/hbase-user/,201004
dcf03a700b91460c5aead596bae7d06b,DataNode throws SocketTimeoutException,http://mail-archives.apache.org/mod_mbox/hbase-user/,200901
71aa537d456996ebe68b264780baa209,BigDecimalColumnInterpreter,http://mail-archives.apache.org/mod_mbox/hbase-user/,201209
92757f9a3ef33129c6924dadda377b8f,Question about HBase,http://mail-archives.apache.org/mod_mbox/hbase-user/,200907
681e58e9de98221db2cb6dc4428f03d4,HBase and hadoop cluster rebalance,http://mail-archives.apache.org/mod_mbox/hbase-user/,200810
8c7f2ad617b82554cbffb30fae532c29,Why did HBase dead after a regionserver stopped.,http://mail-archives.apache.org/mod_mbox/hbase-user/,201003
7bd7429aba70f65b1b5abd3dddc252d3,=?UTF-8?Q?Re=3A_After_hadoop_QJM_failover=EF=BC=8Chbase_can_not_write?=,http://mail-archives.apache.org/mod_mbox/hbase-user/,201412
05077d06997aaca15610965ec39bfd09,scan performance improvement,http://mail-archives.apache.org/mod_mbox/hbase-user/,201011
7a481af58db62a0b23c70942f42c7d80,help! code for hbase 0.90  ries ERROR in hbase 0.94,http://mail-archives.apache.org/mod_mbox/hbase-user/,201212
fb0caf43d73ec215dc1cd0698c847c33,local mode with S3 configuration,http://mail-archives.apache.org/mod_mbox/hbase-user/,200908
3fd2705dd285cc7252aeae2ad091b47c,How to debug/run HBase in eclipse,http://mail-archives.apache.org/mod_mbox/hbase-user/,201111
82a70c34dd2baceb76b69883ae9bb73e,Start hbase with replication mode,http://mail-archives.apache.org/mod_mbox/hbase-user/,201510
3715d5ea2b614e1d6541076704a84982,problem installing hbase,http://mail-archives.apache.org/mod_mbox/hbase-user/,200810
3d3a3c618b9330c72425849da7fdee14,Starting 0.96.0?,http://mail-archives.apache.org/mod_mbox/hbase-user/,201311
98ba87e27538a73d23347d43ea3001c2,Trying to get the region servers working....,http://mail-archives.apache.org/mod_mbox/hbase-user/,201006
04ec5497ad44d44e2855d283806598d1,HBase slowdown while running MR job with GET,http://mail-archives.apache.org/mod_mbox/hbase-user/,201109
8342da35838ddc4f68cca16c89e1c6b0,why hbase using much more space than actual ?,http://mail-archives.apache.org/mod_mbox/hbase-user/,201003
5c1e27a3abee60d8c783fc26d1c485e2,Unable to override zookeeper server maxSessionTimeout property,http://mail-archives.apache.org/mod_mbox/hbase-user/,201311
fdef0c8a8e8cfa8bd2a3e0f54406740e,RegionServer Aborting,http://mail-archives.apache.org/mod_mbox/hbase-user/,201003
a2fb69ca28ccd856d57f7163d1bf10a3,Hmaster and HRegionServer disappearance reason to ask,http://mail-archives.apache.org/mod_mbox/hbase-user/,201207
da68022418029c88c9a4525e1328154d,trick to running hbase on ec2?,http://mail-archives.apache.org/mod_mbox/hbase-user/,201006
c6c29049b283a9aeaea9ac10edee048d,RegionServers Crashing every hour in production env,http://mail-archives.apache.org/mod_mbox/hbase-user/,201303
21d937927ea6b20d8822f2a1e5f21ded,HBase Exceptions on version 0.20.1,http://mail-archives.apache.org/mod_mbox/hbase-user/,200910
27fd9df282f67734400d99b7ac8fc5c0,Profiling map reduce jobs?,http://mail-archives.apache.org/mod_mbox/hbase-user/,201306
f7d29ca6382973e14999bb84e41c5026,newbie questions,http://mail-archives.apache.org/mod_mbox/hbase-user/,200805
dd57e3140b047571e1e2681862c50054,Questions about BucketCache,http://mail-archives.apache.org/mod_mbox/hbase-user/,201502
eb05e449adb5f0925b7442b94afccdf7,problem regarding hbase 0.20.2,http://mail-archives.apache.org/mod_mbox/hbase-user/,200912
097e881844533c7a0b6887a772635199,HBase looses regions.,http://mail-archives.apache.org/mod_mbox/hbase-user/,200905
7582d695b4a39becb49f2046e2dea8e2,memcache size configurable?,http://mail-archives.apache.org/mod_mbox/hbase-user/,200908
